likes,status,text
0,0,"Здравствуйте дорогие наши гости! Мы надеемся, что Вы всегда довольны нашими предложениями и нашей кухней! Мы стараемся радовать Вас каждый день!  Оставляйте здесь свои отзывы : о качестве нашей продукции, о качестве наших блюд, о том , какой из магазинов нашей сети понравился вам больше .  Для подтверждения достоверности отзыва указывайте номер чека  или номер телефона, на который Вы оформляли заказ. НЕПОДТВЕРЖДЕННЫЕ ОТЗЫВЫ БУДУТ УДАЛЕНЫ.  Мы искренне надеемся, что все отзывы в наш адрес будут положительными. Но даже если в какой то момент, вам захотелось связаться с нами и поделиться своими впечатлениями   пишите здесь! Мы обязательно учтем все Ваши пожелания!  С Уважением,  Суши Wok "
10,0,Здравствуйте .очень довольны всей продукцией в частности от наборов по супер низкой цене и замечательное качество и отличный внешний вид роллов.  очень довольны быстрой доставкой)) Хочу выразить лишь одно недовольство у вас очень не удобный сайт.куча  окон из за которых нормально просмотреть меню не возможно приходиться звонить и спрашивать у ваших сотрудников
2,2,"Уважаемая Анастасия Иванова! Мы очень рады,что Вы остались довольны нашей продукцией! Мы и впредь будем стараться радовать Вас отличным качеством и нашей работой в целом! Наш сайт сейчас дорабатывается,для того чтобы Вам впредь было удобнее пользоваться им!  С Уважением, Суши Wok!"
3,0,спасибо))и еще в группе в меню под фото нет ни названий ни цен...напишите пожалуйста
1,2,Анастасия Иванова  вся информация добавлена!
3,0,ЗДОРОВО!!спасибо))))
65,0,"если бы все было такое как на картинке...самое интересное что тот набор за 299 р. все уместилось в 1 коробку так еще и места было достаточно...роллы с огурцом подарите мне микроскоп, чтобы их найти..несмотря на то что магазин в шаговой доступности от моего дома больше туда не пойду...повара тоже удивили... хотя наверно эта одна их тех групп где критику подтирают"
2,2,"Уважаемая Любовь Григорьева! Стандартный вес блюда  Ролл с огурцом  113гр. Просим ответить в личку в каком магазине была совершена покупка и есть ли еще какие либо моменты, которые вас смутили.  Мы постараемся решить эти проблемы, чтобы в дальнейшем радовать вас своими блюдами! С Уважением, Суши Wok!"
4,0,"но не в том помятом виде какой он был в коробочке. как то совсем микроскопично, очень отличаются от суш других кафе. Кафе магазин на наличной"
2,2,"Любовь Григорьева  спасибо,постараемся разрешить эту ситуацию."
0,0,Огромное спасибо! Все было очень вкусно!
0,0,"Спасибо Настасья Силавс! мы рады что вам все понравилось! С Уважением, Суши Wok"
0,0,обалденные суши у вас свежие и очень вкусные!!спасибо Вам.так держать!!теперь будем только у вас покупать...жаль что доставки на дом нет(
1,0,как нет?) я постоянно на дом заказываю..по карте доставка всего 50р.!))) и доставка всего 30мн.))))вообще улет)
1,0,Доставка только в пешей доступности.
0,2,Анастасия Иванова права.только в пешей доступности
3,0,"Очень рада ,что появились такие магазины ))) в ресторанах дорого и не дождаться((( А самое главное очень вкусно и все очень свежее))) повара на науке 12. отличные)))"
2,0,"Здравствуйте!А при покупке ото 500руб. Филадельфия в подарок действует во всех магазинах???Или в праздники эта акция не проходит????8 марта с ребенком зашли в магазин Вашей фирмы накупили в гости ролов,а Филидельфию в подарок нам так и не дали!"
0,0,"Здравствуйте. Скажите пожалуйста мы на Индустриальном,8.03 купили роллов на 700 рублей но филадельфию нам не дали в подарок сказали что праздничный день и акция не действует хотя об этом ни где не говорится. И готовили полтора часа... На Среднеохтинском такого не было обслуживание там лучше..."
29,2,"Юлия Зайцева  спасибо Вам большое, мы рады что все понравилось!) ИРЕНКА ПУСЯ, Екатерина Гусева  акция филадельфия в подарок действует при покупке от 700 рублей и в праздничные дни она не действует. Приносим извинения за не актуальную информацию.Обязательно исправим информацию по акциям в ближайшее время!"
0,0,"Всё ооочень вкусно и быстро, спасибо вам огромное, сервис на высоте и вообще одни плюсы. Удачи вам!)"
0,0,"Очень довольна! Была на Энтузиастов, купила набор Филомания с собой. Все очень вкусно, порции приличные, упаковано аккуратно, девушка  очень любезна!"
0,2,"Ольга Ветницкая  обязательно учтем Ваш отзыв! Татьяна Хон  рады ,что Вам все понравилось)  С Уважением,  Суши Wok "
0,0,"Все очень качественно и вкусно, да и очень удобно!!! Купил и можешь хоть в кино идти))) Вот из предложений есть мыслишка, почему бы не сделать конкурс  Мистер  Суши Wok  2012 ?))))"
0,2,"Спасибо большое Дмитрий Рябов,нам очень приятно) Обязательно учтем ваше предложение по поводу конкурса)) С Уважением, Суши Wok "
0,0,Это вам спасибо)))
1,0,"Здравствуйте, Всё очень вкусно конечно,но вот если бы суши еще бы не разваливались когда их палочками берешь! В основном суши покупаю либо на Просвещения либо на Науки,по поводу первого ни чего плохого не могу сказать,а вот про второй : один раз соус и палочки вообще не положили,в другой раз суши были как то не аккуратно сложены,да и заказ приходится очень долго ждать!"
0,2,"Наталия Прилуцкая мы постараемся решить эту проблему,разобраться с этим и чтобы в дальнейшем таких ситуаций не повторялось! по поводу риса  постараемся лучше отслеживать процесс приготовления риса ,чтобы суши и роллы больше не разваливались! С Уважением,Суши wok!"
1,0,"Мы тоже сегодня заказали на Испытателей запеченые роллы.палочками взять не возможно,не говоря уже о том если опустить в соус она вся разваливается по отдельной рисинке..."
0,0,"Заказывали у вас на индустриальном все очень понравилось, все свежее и вкусное и курьер умничка   принес все к четко оговоренному времени! Будем заказывать еще!"
0,0,"часто ходим,любим!только вот проблемы с картой.... один раз она у меня размагнитилась...накопления естественно пропали без вести,обещали мне все вернуть..вчера ходила,а у меня по прежнему 5  обидно"
0,0,"На байконурской замечательный магазин! Честно признаюсь, долго не могла решиться зайти, не доверяла вам, но зашла все таки и осталась просто в восторге!! брала два набора, на вечеринку в свое ДР, все наелись, наборы оказались большими, невероятно вкусными, главное  свежайшими! Очень приятное обслуживание, СПАСИБО огромное, в ДР получила дополнительную радость от Ваших прекраснейших роллов))) Не в качестве антирекламы или чего то подобного, но на 8 е марта на работу заказывали суши в евразии, доставка задержалась на ДВА часа(!), роллы были отвратительно невкусными, мятыми и отношение цена количество совсем растроило. Поэтому Ваши суши порадовали втройне)))))  P.S а еще приятно, что с сабой к двум наборам дали две больших баночки соевого соуса, так что его не пришлось покупать дополнительно)))"
0,0,"Обычно берём суши на вынос в магазине на ул.Авиаконструкторов, 4. Мой любимый запечёный набор там готовят просто отлично (только сушки немного разваливаются...)) Но вот когда заказали доставку с ул.Уточкина, дом 2, то немного расстроились: сушечки кривоваты, ОЧЕНЬ мало сверху было грибов, креветок и краба на всех, да их прктически и не было, просто мазнули чутка!!! И по закону подлости, именно в этот раз я угощала подругу, которой хвасталась, какие я поблизости вкусные сушки нашла!... В остальном, обслуживание и доставка конечно порадовали) Мне в общем то важно, чтобы на ул.Авиаконструкторов, 4 повара не испортились, хоть туда и приходится самой топать))) Спасибо!"
0,2,"Виола Каминина  постараемся решить вашу проблему! Наташа Егорова мы очень рады,что вам нравятся наши блюда!В дальнейшем будем только радовать вас! Светлана Леванчук постараемся следить за поварами на Авиаконструкторов,чтобы и дальше радовать вас любимыми блюдами!)  С Уважением,компания Суши Wok."
0,0,"Я  обычно покупаю у вас продукты для суши на Просвещении, 38 так как готовлю их сама, хотелось бы видеть больший выбор  рыбы и морепродуктов!! ))"
0,0,"покупали вчера роллы в магазине на Наличной. Брали набор  Филомания , запеченные роллы сигацу и запеченый краб. В подарок еще получили филадельфию) все было вкусно НО: роллы практически все разваливались, ролл с огурцом вообще был практически в раскрученном состоянии. И надо что то делать с запеченными роллами. На запеченные роллы это похоже мало, сверху находилась непонятная прогретая субстанция.  Будем надеяться что в следующий раз будет лучше) будем заходить Суши Вок еще)"
0,0,"Добрый день! Часто покупаю у вас суши и хочу выразить благодарность за хорошую работу.  Теперь решил предложить Вам свою помощь, по этому хочу узнать с кем следует пообщаться на счет сотрудничества с вами? Наша компания занимается перепланировкой и согласованием коммерческих помещений, считаю это  актуально для вашей быстро развивающейся компании.  С уважением, генеральный директор ООО  НЕОПРОЕКТ  Дуньков Алексей Группа в контакте http: vk.com neoproject"
0,0,"Сегодня случайно увидела ваш магазин на Гражданском, решила взять себе сушиков на обед, все отлично, ничего не разваливалось, только на филадельфии очень мало рыбы, из четырех граней только на одной. А так все хорошо, будем брать еще. Пы.Сы. порадовало кол во соуса , большая бутылочка )))"
4,0,"еще раз хочу поблагодарить ребят на байконурской! пришли перед самым закрытием, получили все быстро, вкусно, и с УЛЫБКОЙ (я под конец рабочего дня обычно уже огрызаюсь, а не улыбаюсь, а они молодцы)))  кстати, ничего не разваливалось.  да  и количество соуса всегда радует)))"
1,0,"недавно узнали о вашей компании!попробовали и  понравилось! И вкусно и не дорого! Всё супер! Только вот решили на дом заказать.. позвонили ...сначала у нас долго выясняли где мы находимся(ну то что доставка в пределах двух остановок это мы знаем) попросили перезвонить... В итоге суши доставили,но сказали что обычно сюда не доставляют  сделали исключение!Ресторан находиться на пр Науки м Академическая  пешком 15 минут до нашего дома, ул.Веденеева д4, это не так далеко...на прямую транспорт до нас не ходит...но по расстоянию мы ближе чем в 2 остановках! Может чего то не поняли ...хотя знакомые в этом же доме живут им говорят доставляют...Разъясните пожалуйста!"
3,0,"Заказали доставку на дом. Привезли. Филадельфия   все нормально, ей повезло. Остальные два бокса   в мусорку т.к. соус пролился на боксы и палочки, а внутри боксов все перемешалось и превратилось в одну единую большую массу из ингридиентов."
0,2,"Владислав Романович и Ольга Романович   пришлите пожалуйста в личку адрес магазина,где был сделан заказ. Постараемся решить проблему в кратчайшие сроки."
0,2,"Владислав Романович и Ольга Романович мы разобрались с вашей сложившейся ситуацией.Ответ в Ваших личных сообщениях. С Уважением,компания Суши Wok."
0,0,???? зачем отвечать действительно! ведь вы так дорожите своими клиентами!
0,2,"Катерина Никитина разбираемся с вашей ситуацией.Приносим извинения,что заставляем ждать.Вы получите информацию о разрешении этой проблемы.С Уважением,Суши Wok."
0,0,спасибо! жду!
0,2,"Катерина Никитина ответ у вас в личных сообщениях. С Уважением,компания Суши Wok."
0,0,Была на Лесном пр мне понравилось. Брала лапшу вок и набор  Филомания все хорошего качества. Спасибо!
8,0,"Была сегодня (5.05) в данном заведении на Горьковской, около 13 часов. Заведение отвратнейшее. Объективная оценка: суп дали в странного вида пластиковом контейнере, который даже макдональдс постыдился бы использовать в качестве посуды. Сливочный суп с лососем за 130р представляет собой коричневую жижу с плавающей в ней одиноким куском лосося. Не очень понятно, почему суп назван сливочным   может быть, из за белых  катышек  на поверхности, подозрительно напоминающие свернувшееся молоко? Девушка, принимавшая заказ, не прерывала своего общения с другими сотрудниками, поэтому мы не удивились, что наши заказы перепутали, все наполнители сложили в одну коробку, а во второй подали просто макароны. И готовилось все это очень долго. При нас несколько человек жаловались, что их заказы, сделанные по телефону час назад, до сих пор не готовы. Субъективная оценка: и суп, и воки были настолько ужасны на вкус, что мы не смогли это доесть и ушли голодными. Бывают в жизни огорчения."
0,2,"Очень жаль что некоторые люди, не оценивают наш труд, будьте бдительны я могу ворватся в любой момент, мы стараемся для вас!!!!!!!!!!!!!!"
0,0,"(на Кирочной) что касается суши и роллов   все очень свежее, вкусно, быстро и дешево! заказывали еще лапшу! ФУ с большой буквы. совершенно не понравилось. Девушка со славянской внешностью за кассой   очень милая и обходительная, другим ее коллегам стоило бы поучиться. жаль, что по карте нельзя. да и сайт не удобный. а так большое спасибо."
0,2,"Ваш Психотерапевт   ответ у вас в личных сообщения.   Артур Югай  спасибо за Ваше мнение!)  Ольга Гюлтекин  ответили Вам в личные сообщения.  С Уважением,компания Суши Wok."
0,2,"Кристина Волконская  спасибо за ваш отзыв!Мы рады,что Вам все понравилось!"
0,0,"Заказывала у вас набор Супер Сет на Кирочной 27   все очень понравилось ) Девушка за стойкой очень милая и обходительная, побольше бы таких продавцов! Очень хорошо и доходчиво объяснила как  пройти к магазину, когда я делала заказ по телефону!! Сегодня опять сделали заказ, надеюсь вы не подведете)))) Пожелание   роллки маненькие, чуть чуть бы побольше)))) А к качеству и вкусу пртензий не имею )) Молодцы )) Еще хочу сказать   когда дали листовку с Суши Вок глазам не поверила   думала неужели это МАГАЗИН а не ресторан?))) Для меня очень удобно, заказ сделать по телефону а потом его забрать, не простаивая в очередях)))"
0,2,"Уважаемые гости, читаем внимательно вывеску там написано сеть магазинов Суши Вок, а не ресторан или кафе, чтоб потом войдя в магазин не расстраиваться, кстати у нас цены намного дешевле чем в ресторанах, лично сам знаю , а качество даже лучше.(опыт работы семь лет) в нашей сети даже на отзывы отвечают спаибо огромное"
1,0,"заказывали на дом...всегда всёвкусно очень..но часто  забывают принести ..то приборы, то соус....а сегодня пиво такое кислое....оно наверное испортилось....и соуса вообще нет....а пластиковый контейнер для соуса такой маленький что  туда струдом влезли бы роллы. а что касается рулетов и суши  всё очень вкусно всегда. мне нравится. пойду вылью пиво..."
0,0,"очень нравится ваш магазин на Среднеохтинском 23!:) всё безумно вкусно, отличный соевый соус, очень приветливая девушка кассир и хорошие повара, надеюсь, всё остается на этом же уровне:) сегодня купила набор запечёных роллов (ни один не развалился) на ужин я с ними чуть язык не проглотила:))) минус на Большом пр. П.С. 94 нет коробочек, в связи с чем невозможно заказать обед:( уже дважды обломали с этим:("
