likes,status,text
0,2,"Ну вообще хотелось бы просто, чтобы исполняли такую мелочь. Я не думаю, что им будет приятно, если я сделаю заказ, мне его привезут, а потом увезут обратно изза того, то повара на некоторых точках некомпетентны."
0,0,"Вы довольно часто вводите новинки в меню,поэтому хотелось бы,думаю,и не только мне, больше роллов с угрем. В Практически все они у вас с присутствием такуана вещи довольно специфичной, поэтому приходится отказывать себе в удовольствии. Посему, если у вас уже были подобные просьбы,прошу их учесть! Я постоянный едок на выборгской, всё вкусно,быстро и здорово,почти без нареканий, благодарю вас!"
0,0,"Очень нравится во Всеволожске,все очень вкусно,и хороший персонал. Еще такой вопрос,как можно получить вашу карточку?"
0,0,"ЕДРИТ ВАШУ НАЛЕВО!!!!!!!!! Всё время писала только хорошие отзывы!!!!! Сделали заказ во Всеволожск!!!Прождали два часа!!!!Звоню вашим операторам,а мне сообщают,что такого заказа нет,его как то удалили!!!!Мы сидим ждём два часа,голодные извините,в итоге операторы говорят ни чем не можем помочь!!!!!Что за издевательство???????????????????????????Мы постоянные клиенты !!!!!!!!!!Злая я пипец!!!!!"
0,0,"Ох...я сегодня тоже злая!!!! Сделала заказ   набор Смайл, Бансай, Хаято и Рико (в подарок получила Филадельфию), оформила доставку на дом.....в итоге не доложили имбирь и васаби! Пришлось звонить и ругаться!!!! Через 20 мин. донесли имбирь...а про васаби забыли напрочь!!!!"
0,0,"Значит так: если у вас всё на прослушке,мой звонок был в 20 37 диспетчеру Заказывала во Всеволожск на ул. Невская д.9 кв.33 Это был второй заказ,так как до заказ не сделали потому что сначала заказали дети,а потом мы пришли и тоже решили не готовить,а покушать суши! Заказ был на филоманию и ваш акционный рол !!!!!!Хочу извинений!!!!"
0,2,Анастасия Печальная )Вам хоть что то привезли (
0,0,"Анюта, самое интересное   когда сама хожу забираю   все хорошо, без проблем, а когда делаю доставку   начинается!!!!!! уже сто раз зарекалась на доставку, но у меня маленький ребенок......я пока ее одену.......легче 50рэ заплатить за доставку, правда потом придется звонить и ругаться, но.....факт на лицо   все принесли, что не доложили)"
0,0,"Надо решать недостатки в доставке,товарищи ( Это ваш хлеб и наши ужины обеды. Уж если взялись, так уж давайте без русского авось ("
0,0,"Ой да это точно. !!!!!заказываю с доставкой и вечно проблемы. Заказываю на Художников 24. Постоянно не докладывают имбирьи соус Я уже по телефону об этом говорю но толку мало. К вечеру заказала почти на 900 руб . Соуса положили мало и суши плохо сделаны все разваливались заказала 2 набора за 299 и 499. Запеченые вообще почти не взять было, все рассыпалось. а Филадельфия была так сделана когбудто в первый раз. При этом я заказала еще дополнительно имбирь так вообще по наборам почти не положили Единственное только курьеры доброжилательные. А повора стали плохо готовить. Бывают не свежие огурцы. Очень обидно. Я постоянно заказываю и не мало и уже почти год. И проблем таких на художников стали последние месяца 2 3 . Там я так понимаю кто то из персонала поменялся. До этого проблем не было. Просьба разобраться. Так как сам вес суш стал меньше кладут переодически обрезки маленькие"
0,0,хотим поблагодарить суши вок за испорченный день святого валентина! суши привезли нам в 21   00  а вот пепси в заказе и имбирь с васаби не положили !((( в 23 15 минут звонил курьер что он довез заказ!!! но мы уже спали! получается что мы должны были ждать еще 2 часа имбирь!!!!всего 4 часа!
0,0,Cпасибо мне привезли пепси имбирь и васаби! )))счастью нет придела!
0,0,"В пятницу и воскресенье на наличной 40 всё было очень вкусно:) но..,а пятницу сказали, что заказ нужно ждать от 20 минут. Мне пришлось ждать заказ более часа. Я конечно понимаю, час это более 20 мин, но всё таки:) оценивайте скорость работы ваших сушистов более реально. И мухи...на дворе февраль, а с вас летают мухи. Надо что то с ними делать. Их конечно не много, но всё равно как то очень не приятно."
0,0,"нам очень у Вас нравится, вкусно и недорого, но одно очень огорчает: размер чашечки чая, который можно приобрести и употребить в ваших заведениях. Сделайте большие кружки, пусть хоть и с пакетиком, а то как в самолёте..."
0,0,"У меня кста такой вопрос, а по какому принципу вы кладёте васаби? На днях купили 2 набора и 2 совершенно разных васаби! Один ярко красный и ядрёный, а второй розовенький в помойку :)"
0,2,Ааа ну может) я их как то не отличаю по названию :)
0,2,имбирь бывает разный) все зависит от партии...
0,0,"никакую валинтинку нам 14 февраля не положили,мелочь,а все равно... (( в смс рассылке писали о подарках,а единственным подарком была отмена акции  филаделфия в подарок ."
0,0,23 го февраля при заказе набора никакого подарка не было(
0,2,и у нас не было!!!
0,2,Подарки на 23 февраля вручались только мужчинам и лично в руки.
0,0,"Был у вас на Кирочной 27  полностью доволен и приготовлением и скоростью и приветливостью персонала, Не разу не пробовал суши, очень понравилось что не смотря на то что я не разу не ел суши, Кассир Юлия не разочаровала своими советами мой вкус, Ещё не раз буду посещать именно это место, Остался очень доволен и я и мои друзья и предложенными вариантами роллов и качественным обслуживанием и отношением всего персонала к вашим клиентам! Огромное спасибо мне очень приятно,тем более от души!"
0,0,"Кстати, на 14 е число тоже подарка не было( Только смс приходят, а подарков никто не дарит("
0,0,"Добрый день, а почему не во всех магазинах есть пицца 3D и нет ролла Хиноки?"
0,0,"первый раз заказали на комендантский, вкусно, быстро, проблем никаких, за суши теперь только к вам, спасибо"
0,0,"пиццы 3д нет теперь ни в одном магазине, а ролл хиноки вошел в основное меню, есть теперь везде"
0,0,"жалко что пиццы нет, оч вкусная была("
0,0,"Уже заказывали с собой много раз и в разных точках. Все отлично! Все хотим попробовать горячее и супы. Спасибо, что есть теперь такое местечно, где быстро и вкусно готовят наши любимые наборы!"
0,0,"очень довльна всем)всё всегда очень вкусное и свежее)скажите пожалуйста а в Магазине ввашем возможно купить все ингридиеты для кимчи супа или мисо суп?.мне очень нужно(водоросли Вакаме сушеные,мисо паста белая,сыр тофу"
0,0,Очень понравился набор  сенсация .))Спасибо!)
0,2,Предложения!? Магазин в Рыбацкое! СРОЧНО!!!!
0,2,"Подскажите пожалуйста,можно ли отказаться от смс рассылки? Я перестала есть рыбу и в Суши Wok больше  не бываю,раздражают очень постоянные смс!"
0,2,"Anastasia, все это есть в магазине)"
0,0,"Дорогие суши Wok. Испортили мне весь праздник 8 марта! Спасибо вам! Желаю, чтоб у вас был такой же испорченный день."
0,0,И 14 февраля не было никакой валентинки! Просто обман. Сказали вместо Филадельфии в подарок дадут валентинку. Ничего не дали вообще.
0,0,"А я наоборот хочу сказать большое спасибо за 8 марта суши воку на Авиаконструкторов 4 ))Несмотря на много заказов ,все мои 3 набора были сделаны очень быстро)Все вкусно и качественно!Спасибо вам большое)Всей семьей наелись до отвалу!!)Еще и карточку дали(заказали на 1100 руб))Вообщем очень рада!)Спасибо,работайте в том же духе)"
0,0,"На комендантском 30 отвратительно готовят!!!! сегодня это подтвердилось. рис недоварен и ужасен на вкус, сами роллы....обычно берем на уточкина или авиаконструкторов, сегодня поленились дойти.....и зря((("
0,2,"и, кстати из опыта 23, 14 и 8 можно сделать вывод   по праздникам к вам ни ногой!!! качество ЗАМЕТНО снижается!!!"
0,0, 1 к комендантскому 30. Сколько раз брал там наборы и каждый раз Г....)
1,2,Помоему на отзывы им вcё равно.
0,0,"Граммовку роллов на пр. просвещения так и не соблюдают. Только пару раз после оставленной жалобы граммовка была отличная. Заказали на 8 марта два набора сахара и роллы были просто позорно маленькими и холодными, некоторые роллы были точно раза в 3 меньше обычных, с филадельфией тоже обделили, в общем надеюсь всё таки примут какие то меры. И еще забыл,  хватит соус в ролл аяши разбавлять майонезом, это просто отвратительно"
1,0,а нам вчера не положили ни палочки ни контейнеры для соуса(((( неприятно было
0,0,"Я вам cоветую заказывайте на науки 12... я уже в 5 6 магазинах пробовал, везде говно кроме этого."
0,0,мне безумно нравится магазины в м.озерки и у м.пр.просвещения. молодцы!
0,0,"Ну а что вы предпримите? Я уже 3 й раз пишу вам жалобу, что то поменялось? На науки 24 только 1 раз приготовили хорошую лапшу, как раз после моей жалобы. После этого всё осталось по прежнему, обычный доширак. Я рад, что мне пошли навстречу и как постоянном покупателю согласились возить с науки 12, вот там повара отличные. Неужели так тяжело поварам сказать, что лапша ДОЛЖНА быть с соусом и слегка обжарена?"
0,0,"На м.  Садовая   брала ролл по акции, мне не понравилось обслуживание и сами роллы были маленькими :(( Не помню какого числа это было, знаю, что в начале февраля и за кассой стояла женщина с темными волосами и короткой стрижкой. Ничего особенного не произошло, просто остался неприятный осадок. В следующий раз рискнула и взяла набор  сенсация  на Косыгина и осталась довольна и обслуживанием, и роллы  были больше и вкуснее. Спасибо работникам на пр. Косыгина, была у них вчера 10. 03. 13.)))"
0,0,"к вопросу о аяши, как и в большинстве организаций сырный соус делается на основе майонеза, вопрос актуален, но к сожалению технология приготовления такова."
0,0,"Сегодня был на ул. Торжковская, 6. Сушисты кавказской национальности танцевали лезгинку под громкую кавказскую музыку и 25 минут готовили бизнес ланч при пустом зале. Был удивлен, больше не пойду :)"
0,2,Лезгинка это мощно)))) ахаха
0,2,"Ахаха, ну надо же мальчикам хоть как то развлекаться)) 13 часов крутить роллы это ад))"
0,2,"Оля, ахаххахахахах)))) все развлекаются, как могут))"
0,2,"Юля, мы роллы крутим от скуки, а они танцуют)) Привычная обстановка)))"
0,2,"Хотелось бы узнать, вернут ли диваны и хорошие столы в СушиВок на Горьковской?) Было гораздо приятнее сидеть, чем теперь   на жестком дереве..) Да и приятнее как то смотрелось, а нынешняя мебель, мне кажется, не подходит вообще в общему виду."
0,0,"здравствуйте, постоянно покупаем суши на кирочной очень вкусные и свежие( но маловаты )   ) ,буду заказывать на своё день рождение, , у вас действуют какие нибудь дополнительные скидки на день рождение? )))"
0,0,"Всегда заказываем ,очень вкусно,все устраивает!Только вчера огорчило,что не доложили ролл Самурай в заказ,хотя оплату за него взяли.Сами виноваты ,конечно,никогда не проверяем комплектацию,все на доверии.Пожалуйста,повнимательнее"
0,0,"А мы опять с друзьями набрали наборчиков на Энгельса 113 и безумно довольны быстро,очень приятная девушка кассир,и ,самое главное, все свежее,никаких претензий !Мы довольны !Всегда берем на Энгельса 113"
2,2,"отлично!!! правдоподобные комментарии удаляются!!! за качеством следить надо, а не комменты стирать! вот так клиентов и теряют!!!!!"
0,2,Это в Москве один ролл 1000р стоит?) Фига у вас там цены)
0,2,Когда вы уже в Смоленске откроетесь?(((((((((Жду не дождусь!
0,0,"Хочу тоже пожаловаться... В первый раз... Надеюсь, что в последний. Забирала заказ 30.03.13 на Гражданском, 43. Заказ 001722193. Уже дома, открыв коробочку, обнаружила, что нет васаби и имбиря((( Вообщем, просто поела. Остался неприятный осадок. Теперь проверять все контейнеры при получении? Так что ли??? Я понимаю, что все на потоке... Но почему должны клиенты должны быть ущемлены в качестве услуг? надеюсь, что больше такого не будет..."
0,2,"Алексей, Вы уже утрируете. Заказ   это не сколько персон, а сколько порций суши роллов входит в заказ. Т.е. к каждой порции полагается определенное кол во соуса, имбиря, васаби. Изначально, это все уже включается в стоимость каждого блюда. А то, что мы не получаем это при покупке, выходит экономией заведению и продается как доп.опция за 30 руб."
2,0,"Ребята , очень нравятся ваши роллы и супы! Но ну очень мало васаби и имбиря, нам с мужем еле на половину сета хватило, как то вы раз на раз кладете  то нормально, то так мало..Пожалуйста уже определитесь с размером! Я беру то на пр.Просвещения то у м. Политехническая и вкус васаби  на Просвещения он острый как и должен быть, а на Политехнической вообще можно спокойно есть скорее просто вкус, пожалуйста уладьте и это! Только что съели ваши роллы поэтому воспоминания еще свежи.."
0,0,"1. Филадельфия в подарок   акция при покупке ОТ 700 рублей. А не на каждые 700. Все правильно разбивайте чеки. 2. Соус, васаби и имбирь идет по количеству роллов  боксов.  на один набор (из разряда ФИЛОМАНИЯ, САХАРА, СЕНСАЦИЯ и т.п.) идет один соус. среднее 1 соус на 4 ролла. В случае покупки набора из 4 роллов и приборов на 5 персон, соус будет один. т.к. для 4 роллов этого вполне достаточно. на один ролл в отдельном заказе так же идет 1 соус т.к. не выдать его магазин просто не может, а другой посуды (более мелкой) не предусмотрено.  Если вам кажется мало, а позволить купить не в состоянии разбивайте чеки!!!   доп.инфо:  Филадельфию в подарок  и кол во гарнира(васаби, имбиря и соуса) распределяет программа, жадность кассира здесь не причем!"
0,0,"Здраствуйте ,я очень люблю ваши суши и постоянно покупаю только у вас.Но уже второй раз оформление,время ожидания и ингредиенты не соответствуют тому что есть в прескурантие и в словах ваших сотрудниках."
0,2,"Добрый день! Интересно, кто нибудь из администраторов прокомментирует наши последние отзывы??? Уже возникают мысли делать заказы в другой сети японской кухни...."
0,2,"Видимо я просмотрела комментарий Дианы... Если это офиц.ответ, то все таки придется менять компанию... Т.к. если сравнивать то, что мы получали в начале развития данной сети, и то, что получаем сейчас... Две большие разницы. Соуса, блин, пожалели... Вот это, как раз, и не повод для экономии. Это сервис. Как бутылочка соуса в 100 мл полагается на 4 набора роллов? В последнее время у меня только вопросы."
0,0,"Мы заказывали на днях, соус был очень концентрированный, мы разбавили, но все было очень вкусно! :)"
0,0,"Ах, да... открыся напртив Вока суши мар.. та же филомания, только за 299... но что то не то) соус вообще сладкий был, на унаги похож..."
5,0,"Ирина, да вы задолбали со своими соусами.в соус макают роллы, а не закусывают роллами выпивая соуса стопками!!!!покупайте если мало!!!вам дают на халяву столько сколько установленно стандартом!!!!берите 4 соуса и один ролл,наедитесь))))"
0,2,"ирина у нас стандарт имбирь на один ролл идёт 7гр васаби 2,5 соус на покупку на 500 рублей одна бутылочка на сумму от 550 две и так далее!!"
0,2,вот теперь и прикиньте на сет из 4 роллов идёт 28 гр имбиря 10 гр васаби и один соус!!как то так!!
0,0,"Здравствуйте, подскажите,пожалуйста, актуальна ли на сайте информация по ценам? Вчера в заказе нам привезли 2 ролла хиноки по 189р за каждый,  а на сайте указана цена 99р... Заказ 001774688"
